;primcmnum;subcmnum;text;username
803;4;14;Für den jungen Mann gab es keinen Grund sich umzubringen. Afghanistan ist kein schlechter Ort zum Leben, immerhin leben aktuell über 30 Millionen Menschen dort. Und wenn es ihm dort nicht gefällt, kann er sicherlich in viele andere Staaten emigrieren, z. B. in den Irak oder nach Jordanien, nach Ägypten oder Oman. Es gibt keinen vernünftigen Grund für einen Suizid, eine Ausweisung aus Deutschland gehört jedenfalls nicht dazu. Wie man so hört läuft die Wirtschaft in der Türkei unter Erdogan so richtig super, bestimmt hätten sie dort einen jungen kräftigen Mann in der Baubranche gebraucht. Immerhin bauen sich Mega-Flughafen und Mega-Kanal nicht von alleine.;Zac
804;4;15;"""Ein  Gesetz oder Befehle zu befolgen ist aber schon was anderes"". Absurde Argumentation.Wenn Unrecht in Gesetze gegossen wird, bleibt es Unrecht.Sollte man gerade als Deutscher eigentlich wissen. . . Der Schiessbefehl an der innerdeutschen Grenze z.B. war ja auch Gesetz.Nach ihrer Logik hätte demnach kein Schütze verurteilt werden dürfen.";Ostwestfale77
805;4;16;Die Frage ist, wann er sich was hat zu Schulden kommen lassen. Vielelicht war er da noch minderjährig. Wer so viele Jahre schon in Deutschland seit seiner Jugend gelebt hat, wird es kaum schaffen, sich in dem evrmeintlichen Heimatland wieder einzuleben. Es ist eine Tragödie und zeigt, wie unmenschliche die Abschiebungen sind.;Dr Kathrin Guenther
806;4;17;Nein, Integration geht nur von beiden Seiten. Wie soll man sich denn integrieren, wenn man von niemandem begrüßt und die hiesigen Gepflogenheiten und die Sprache beigebracht bekommt? Wenn man von den Alteingesessenen nur Unfreundlichkeit erfährt...;dancingprincess
807;4;18;"""Welche Lebenssituation hatte er hier? Wie gut war er integriert? Das alles muss man, finde ich, berücksichtigen."" Anscheinend wurden Gründe in der Person berücksichtigt: Körperverletzung, Diebstahl. Spricht nicht für Integration.";jackterrier
808;4;19;Na, solnge dieser Todesfall vom Gesetz gedeckt ist brauchen wir ja uns keine Gedanken machen. Schon gar nicht, ob wir ein Problem mit der Gesetzgebung haben. *kopfschüttel*;Tanja Gönner
809;4;20;"Was ist daran fragwürdig, einen hochkriminellen verurteilten Straftäter, der wiederholt das Gastrecht missbraucht hat,  in sein Heimatland abzuschieben??? Und warum ist die Meldung über seinen Suizid so wichtig, wer kümmert sich um die vielen Menschen in Deutschland, die sich hier das Leben nehmen? Auch die Empörung einiger Links-/ grüner Politiker und die Schuldzuweisung an Seehofer ist völlig daneben. Wer von diesen ""Gutmenschen"" kümmert sich denn selbst um Flüchtlinge, gibt ihnen ein Heim und ein Auskommen? Ich kenne Keinen. Außer Sprüche klopfen, Schuldzuweisungen und die Probleme der deutschen Bevölkerung aufzubürden steckt nichts weiter dahinter. Und dann wundern sie sich noch, das sie keiner mehr wählen will.";christel hoppe
810;4;21;Meine Güte, kennen Sie eigentlich auch eine andere Epoche als die Zeit der Nazis? Wollen Sie nun Rechtsstaat oder nicht? Sagen Sie nur ganz offen, wenn Ihnen Gesetze zuwider sind.;Ma_ria
811;4;22;"""Deswegen sollte man die Leute gar nicht erst ungeprüft hereinlassen bzw. nur in der Anzahl, die die Behörden und Gerichte auch zeitnah bewältigen könen und die Verfahren einschließlich aller Rechtsmittel so zügig abwickeln, dass sich Menschen ohne Bleiberecht gar nicht erst integrieren."" (sic.) Jeder hat ein Recht auf Prüfung des eignen Falles und diese Prüfung findet im Land statt. Erst Einreise und dann die Prüfung auch bei Dublin Fällen. Das ist geltendes Recht und anderst auch nicht praktikabel. Die Gerichte müssen sich an die Anzahl der Fälle anpassen. Wird auch versucht braucht aber Zeit. Ich stimme aber zu das es in diesem Fall mit 8 Jahren wesentlich zu lang gedauert hat eine Entscheidung zu treffen. Hier etwas mehr zur Rechtslage: https://verfassungsblog.d... Abgesehen davon hätte Afghanistan nie zum sicheren Herkunftsland erklärt werden dürfen.";Der Eskapist
812;4;23;"Muss man nicht. Als Straftäter hat er seine Chance verwirkt. Es gab sicher nicht nur einen lapidaren Fall, sonst hätte man wohl anders entschieden. Suizid zu begehen war im übrigen seine Entscheidung, wenngleich die Lage für ihn sicher schier aussichtslos erschien. Mit 23 sollte er im übrigen auch in der Lage gewesen sein, die Konsequenzen seines Handelns abzusehen. Das Problem ist aber, dass es oft genug nicht ernst genommen wird. Mehr als ein ""Du du"" gibt's meist nicht - und das weiß dieses Klientel. Der junge Mann hat offenbar daneben gegriffen und die Situation unterschätzt. Mein Mitleid hält sich in Grenzen. Aber bitte, genießen Sie Ihre Meinung.";MrL
813;4;24;"Das geht auch deutlich aus dem vorliegenden Text hervor: ""Der Mann sei in Deutschland rechtskräftig wegen Diebstahls und Körperverletzung verurteilt gewesen""";Wyllemora
814;4;25;In der Regel erhalten Ausländer nach 8 Jahren Aufenthalt in Deutschland auf Antrag einen deutsches Pass, sofern sie nicht illegal eingereist sind.;MMAA
815;4;26;"""Der Mann sei in Deutschland rechtskräftig wegen Diebstahls und Körperverletzung verurteilt gewesen."" Haben Sie das überlesen?";Zauberpferd
816;4;27;"""Welche Lebenssituation hatte er hier? Wie gut war er integriert?"" Falls Sie es noch nicht mitbekommen haben: Raub, Diebstahl, Widerstand gegen Vollstreckungsbeamte, schwere Körperverletzung, Drogenbesitz";Herr Mannelig
817;4;28;Er war außerdem Straftäter (Diebstahl und Körperverletzung) und kam übrigens illegal ins Land. Das Recht auf Einreise ist nicht ersitzbar.;robert1234
818;4;29;Sie können sich Ihre Holocaustrelativierung sparen, wenn Sie noch suggerieren wollen, dass Transitlager denen in Bergen-Belsen und Auschwitz gleichen, nur zu. Da sind Sie in netter Gesellschaft von anderen Querfrontlern. Ekelhaft.;Nagenca
819;4;30;"Nun, ""inhuman"" zu schreien, an die Nazis zu erinnern ist leider auch ein Reflex. In der Kommentarspalte lässt sich leicht anklagen. Der Mann ist mehrfach straffällig geworden, niemand hat ihn dazu gedrängt, ich bin genau genommen sehr dafür, straffällige Flüchtlinge auszuweisen. Diese vergiften nachhaltig und unvermeidlich das gesellschaftliche Klima. Das muss jedem klar sein, der ins Land kommt. Und damit meine ich nicht ein Sandwich aus Hunger klauen... Muss man das überhaupt begründen? Er wird gewusst haben, dass sein Tun nicht rechtens ist. Für Flüchtlinge in und außerhalb Deutschlands wird pro Jahr deutlich mehr ausgegeben als für Bildung im Land. Da wird man schon unterscheiden dürfen und ich finde das nicht rassistisch. Dass der Mann sich nun das Leben genommen hat, ist zwar menschlich ein Unglück, aber wir werden nicht jede Misere lösen können. Und am Ende ist mir unser Land und unsere Bürger näher. Ich finde das recht normal.";alba63
820;4;31;Er war ein Straftäter, mehrfach vorbestraft. Drogenhandel und schwere Körperverletzung.  Eine ausgezeichnete Integration in die deutsche Gesellschaft...;Schnick.Schnack.Schnief
821;4;32;Ja, in der Demokratie.;freidenker80
822;4;33;Er war ein mehrfach verurteilter Straftäter. Tun Ihnen die Menschen, die seine Opfer waren, auch leid??;Ehemalige linke Sozialdemokratin
823;4;34;Wurde 2011 wirklich das Alter geprüft, und erst ab 2015 nicht mehr? Kann gut sein, daß der Mann schon 18 oder älter war. Wird man nicht mehr feststellen können.;La fin du bon temps
824;4;35;Im Übrigen wurde die Entscheidung in Hamburg getroffen , auch weil der Mann straffällig geworden war. Bei vielen Tausend Menschen sind leider immer einige dabei die sich umbringen , selbst unter in guten Verhältnissen lebenden Deutschen. Bei dem Druck unter dem Asylbewerber stehen ist das sicherlich verständlich. Da hat der Staat insoweit eine Mitschuld , in dem er es den Leuten erlaubt sich hier zu sehr einzuleben. Dann ist die Enttäuschung hinterher um so größer.;Heinz_K
825;4;36;Nein Seehofer hat seine Meinung immer klar geäußert . Ich bin kein Fan von Ihm , aber in diesen Fällen ist er gradlienig .;Heinz_K
826;4;37;"""Integrieren müssen sich Einwanderer selber."" Integrieren geht wesentlich einfacher, wenn man dem Neuen die Hand reicht. Nicht jeder ist ein Extrovertierter, der auf einer Party bestens klarkommt, obwohl er niemanden kennt. Gelobt sei der, der den Neuling in die Runde integriert. Zum Glück teilt nicht jeder in D Ihre Ansicht.";Derwitz
827;4;38;Ich kenne Andere ,die sich vom ersten Tag an integriert haben. Und die haben nicht gestohlen und auch nicht Andere verletzt. Und die kamen aus vielen verschiedenen Ländern. Auch eine Afghanin darunter .;Heinz_K
828;4;39;Integration muss von beiden Seiten ausgehen.;sw1
829;4;40;„Schon bald nach seiner Ankunft wurde er straffällig. Wie die Hamburger Ausländerbehörde WELT mitteilte, wurde er rechtskräftig verurteilt wegen Widerstands gegen Vollstreckungsbeamte, versuchter gefährlicher Körperverletzung, Diebstahls und Drogenbesitzes. Darüber hinaus liegen Strafanzeigen gegen ihn vor wegen Raubs, Diebstahls, gefährlicher Körperverletzung und Drogenbesitzes.“  Quelle: Die Welt;mayor-west
830;4;41;"""Nicht verantwortlich""? Sie irren. Wir (DE) sind für ALLE verantwortlich, die sich hier aufhalten, egal aus welchem Grunde. Nur mal als Beispiel: Erleiden Sie als DE-Bürger in AT einen Autounfall, dann ist AT sehr wohl dafür verantwortlich, dass Sie Ihr Recht bekommen - und umgekehrt. Kann man nicht vergleichen? Vielleicht. Aber Ihr Satz ""Deutschland ist für den Jungen im übrigen nicht verantwortlich …"" dieser Satz ist grundlegend falsch.";ketzer64
831;4;42;Was bitte ist falsch daran, einen mehrfach rechtskräftig verurteilten Straftäter abzuschieben, wenn er am Ende eines rechtsstaatlichen, vom Steuerzahler finanzierten Verfahrens unanfechtbar ausreisepflichtig ist, dem aber nicht freiwillig nachkommt? Der Fehler liegt doch nicht darin, dass hier abgeschoben wurde, sondern darin, dass viel zu spät abgeschoben wurde.;Gapbewohner
832;4;43;""" Aber 8 Jahre hier leben und dann abgeschoben werden?"" Er hätte eigentlich schon viel früher abgeschoben müssen, da bereits 2012 sein Asylantrag abgelehnt wurde. Er hat sich halt durch alle Instanzen geklagt und wurde dabei mehrfach straffällig.  "" Welche Lebenssituation hatte er hier? Wie gut war er integriert?"" Arbeitslos und kriminell. Also nicht gut integriert.  ""Das alles muss man, finde ich, berücksichtigen."" Das hat man, deswegen wurde er vollkommen zurecht abgeschoben.";Tillmann König
833;4;44;"""zeitnah"", ""zügig"", ""gar nicht erst integrieren"". Na schön. Und was machen wir mit denen, die nicht zeitnah und zügig entfernt worden sind? Die Untergetauchten erwischen wir nicht, also verbessern wir die Statistik des Ministers mit denjenigen, die leichter zu haben sind - und das sind dann diejenigen, die sich ""auf gutem Wege"" befinden. Ob der hier in Rede stehende Afghane auf (halbwegs) ""gutem Wege"" war oder auf einen ""guten Weg"" hingeleitet hätte werden können, das können Sie nicht beurteilen - das wollen Sie ja auch nicht - und ich kann es auch nicht.";ketzer64
834;4;45;„Integrieren müssen sich Einwanderer selber.“ Der Satz ist in dieser Einfachheit schlicht falsch. Gehen Sie mal auf eine Party, auf der niemand mit Ihnen spricht und Sie ignoriert, da werden Sie bestimmt großen Spaß haben. Alle Beteiligten müssen mitspielen, damit Integration gelingen kann.;KommentatorAusHH
835;4;46;Integration ist also etwas schlechtes?! Erst sollen sie sich integrieren, aber wenn sie das denn tun sagt man, sie hätten schneller abgeschoben werden sollen, damit sie sich eben nicht integrieren.  Straftaten hier sind eine Sache. Nicht ok und zu sanktionieren. Den jungen Mann dann aber in ein kriegsgebiet zurückschicken?! Das können unsere westlichen Werte aber nicht sein.;Boergi
836;4;47;"""(...) Es gibt keinen vernünftigen Grund für einen Suizid, eine Ausweisung aus Deutschland gehört jedenfalls nicht dazu. (...)"" Auch wenn ich seine Straftaten nicht außer Acht lasse: 8 Jahre in einem Land zu sein, während einer prägenden Phase des menschlichen Lebens, um dann abgeschoben zu werden, sind keine Peanuts.  Das ist in erster Linie komplettes Behördenversagen.";norudoman
837;4;48;Zur Erinnerung: Keiner der 9/11 Teroristen kam aus Afghanistan!;Waltraud Gundlach
838;4;49;"Es ist dann fragwürdig, wenn sich der Mensch hier eingelebt und Fuß gefasst hat.  ""Der Mann sei in Deutschland rechtskräftig wegen Diebstahls und Körperverletzung verurteilt gewesen. "" Das ist aber ein objektives Kriterium, dass dem nicht so war. irgendwo brauchen Sie Kriterien.  Wenn die Furcht davor abgeschoben zu werden mehr dafür sorgt, Straftaten zu unterlassen, ist damit vermutlich mehr gedient als mit den eigentlichen Strafen. So tragisch der Fall ist, kann er für andere Jugendliche ein mahnendes Beispiel sein.  Freiheit wie es sie hierzulande gibt, bedeutet auch Verantwortung für seine Entscheidungen zu übernehmen - MUSS es bedeuten.  Über die Entscheidung sich das Leben zu nehmen will ich nicht urteilen, aber die Verantwortung dafür den ""Behörden"" oder gar Seehofer persönlch anzulasten, halte ich für  kurzsichtig und falsch.";Nils Hellstrøm
839;4;50;Wenn man als ganz junger Mensch sein halbes Leben hier verbracht hat, seine Freunde hier gefunden hat, hier integriert ist, ist eine Abschiebung in die Hölle Afghanistan einfach unmenschlich. Gesetzeshüter haben in der Regel einen Ermessensspielraum. Hier ging es denen nur darum, möglichst viele Leute medienwirksam abzuschieben und man hat sich darüber auch noch gefreut. Blickpunkt Landtagswahl Bayern. Einfach widerlich.;JoggerSN
840;4;51;#asklepion Was für ein unfassbarer Blödsinn, den Sie hier verbreiten. (bitte nickname wechseln, ist ja peinlich);masignobilis
841;4;52;„Wie soll man sich denn integrieren, wenn man von niemandem begrüßt und die hiesigen Gepflogenheiten und die Sprache beigebracht bekommt? Wenn man von den Alteingesessenen nur Unfreundlichkeit erfährt...“ Von welchem Land reden Sie? Von Deutschland sicherlich nicht. Da werden solche Jungs richtig gut versorgt, bekommen ein Dach über dem Kopf,  Geld vom Staat, Medizinische Verdorgung vom Staat,  eine Schulausbildung, Sprachskurse, Betreuer, Paten, Sozialarbeiter… Und die Menschen im Alltag in Deutschland sind auch nicht alle unfreundlich, ganz im Gegenteil! Daran scheitert die Integration in Deutschland nicht.  Wer kriminell wird, zum Dieb wird, andere körperlich verletzt oder sexuelle  Gewalttaten verübt, der trägt einzig und allein selbst die Verantwortung für seine Abschiebung,;Kulmbach
842;4;53;"Sie diffamieren Flüchtlingshelfer als ""Gutmenschen"" und wundern sich, dass Sie keine kennen? Ich bin seit längerem in der Flüchtlingshilfe aktiv und kenne viele, aber wenn ich jemanden treffe, der empathielos alle in einen Topf mit Straftätern wirft und mit Whataboutismen vom Thema ablenkt ( ""unsere"" Suizidgefährdeten), dann spare ich es mir, mich zu outen, weil mir meine Zeit zu schade für nutzlose Diskussionen ist. Womöglich sind Sie umgeben von ""Gutmenschen"" und wissen es nicht mal. Straftäter abzuschieben finde ich übrigens im Grundsatz richtig, und kein ""Gutmensch"", den ich kenne, ist komplett dagegen. Mein persönlicher Eindruck ist aber, dass überhaupt nicht geschaut wird, wer sich hier integriert, im Gegenteil, die ""Guten""werden leichter abgeschoben, weil sie nicht untertauchen.";Kiveriotissa
843;4;54;"""Besser wäre es sie direkt der diplomatischen Vertretung ihres Herkunftslandes zu übergeben."" Möglicherweise. Es dürfte aber eine Illussion sein anzunehmen,  ausländische diplomatische Vertretungen würden sich der Abschiebeaufgaben Deutschlands annehmen. Jedenfalls nicht in der Quantität, die hier im Raume steht.";Romara
844;4;55;Es handelte sich um einen verurteilten Straftäter. Es ist richtig, dass er abgeschoben wurde. Wenn die Gefahr eines Selbstmorde ausreicht,die Abschiebung zu verhindern, dann könnten wir keinen mehr abschieben. Das wäre falsch. Mit derselben Logik dürften wir auch keine Flüchtlinge aufnehmen, weil ja die Gefahr besteht, dass unter ihnen Mörder, Vergewaltiger und Terroristen sein können.;oskarherbert
845;4;56;Ihre Sicht lässt verzweifeln. Dieses Lavieren um geltendes Recht und gesunden Menschenverstand ist verstörend. Die Deutschen werden nicht aussterben. Diebe und Schläger müssen nicht importiert werden. Auschliesslich exportiert. Was ist für sie falsch daran?;mehrfachgesperrter
846;4;57;Aus welchem Wissensfundus haben Sie denn das herausgekramt...gibt es auch tatsächliche soziologische Quellen die Ohre ziemlich steile These unterstützen? Mal davon abgesehen das die Prägung eines Menschen individuell sehr unterschiedlich ist und im Grunde eigentlich nie abgeschlossen scheint. Können sich so genannte Prägungen selbst noch in hohem Altee ändern. Kurzum, was Sie da behaupten trifft vielleicht auf Sie zu, aber vielleicht nicht auf den Rest?;Ego-Shooter
847;4;58;"""Von welchem Land reden Sie? Von Deutschland sicherlich nicht."" Er antwortete auf den Mitforisten, der meinte, Ausländer haben die Pflicht sich gefälligst alleine zu integrieren. Wenn die Integration dann scheitert, weil der Einheimische die Integration verweigert, dann ist trotzdem der Ausländer Schuld.";Derwitz
848;4;59;"""Welche Lebenssituation hatte er hier? Wie gut war er integriert?"" Mehrfach vorbestraft wegen Diebstahls, Widerstand gegen die Staatsgewalt, schwere Körperverletzung. Ein Mann hat nur knapp seine Mißhandlungen überlebt. Ein gerngesehener Nachbar für Sie?";Dr. Siri
849;4;60;Auch Straftäter haben ein Recht auf Leben und körperliche Unversehrtheit. Wer nach Afghanistan abschiebt nimmt billigend in Kauf, dass das passiert.;Ostwestfale77
850;4;61;Ich schätze da das Verhältnis 80/20. 80 Prozent Eigeninitiative, 20 Prozent wie eine Gesellschaft Einwanderer aufnimmt. Viele Deutsche glauben sie wären schuld wenn sich jemand hier nicht integriert. Damit überschätzen sie ihre Möglichkeiten. Für Straftaten gibt es außerdem überhaupt keine Entschuldigung.;Brindisi
851;4;62;Hier gibt's doch Integrationsangebote ohne Ende. Kein Land kommt seinen Einwanderern so entgegen wie Deutschland. Was sollen wir denn noch machen?;Brindisi
852;4;63;"Das haben Sie missverstanden. Ich meinte wer will kann sich in Deutschland integrieren. ""Einheimische die Integration verweigert,"" Wir verweigern die Integration? Kein Land kommt seinen Einwanderern mehr entgegen als Deutschland, wir tun sehr viel, dass die Leute hier ankommen.";Brindisi
853;5;2;Den Grund halte ich für recht offensichtlich. Oder würden Sie noch eine Perspektive sehen, wenn Sie von 15 bis 23 in Deutschland gelebt haben,und dann aus Ihrem Leben gerissen und in ein Bürgerkriegsland abgeschoben werden?;WiderDieGanzeAufregung
854;5;3;>in ein Bürgerkriegsland abgeschoben< Nein, in die Heimat, da wo er her kommt und sein zuhause ist, bei seinen Leuten und zu seinen alten Freunden, die sich alle freuen und auf ihn warten.;karlmue
855;5;4;"Das weiß man doch gar nicht. Im Artikel steht, dass er in einem Hotel gefunden wurde, wo Menschen einige Tage unterkommen, die nicht wissen, wo sie unterkommen sollen. Klingt anders als ""bei seinen Leuten"" und ""alte Freunde""...";Lucy in the sky
856;5;5;Wenn die nicht tot sind oder gar in einem unsicheren Gebiet leben oder oder! Afghanistan zu einem sicheren Land zu erklären oder zu einem mit sicheren Gebieten ist reine Willkür. Es ist ein Failed State, in dem jeden Tag eine neue Taliban-Revolte ausbrechen kann. Also, dem Recht zu folgen ist das eine, ein Land für sicher zu erklären, was für deutsche Reisende aber nicht sicher sein soll und das obendrein ein Failed State aus dem Lehrbuch ist ist etwas völlig anderes.;metua
857;5;6;Wenn es einem Flüchtling was bedeutet in Deutschland anstatt in Afghanistan zu leben darf er halt hier keine Straftaten begehen. So schwer kann es doch gar nicht sein hier niemanden zu bestehlen bzw zu verletzen!;Brindisi
858;5;7;Ach, Sie wissen, daß er dort noch Familie und Freunde hatte? Lassen Sie uns doch an Ihrem Wissen teilhaben und liefern Belege......;r.schewietzek
859;5;8;"""Ach, Sie wissen, daß er dort noch Familie und Freunde hatte? Lassen Sie uns doch an Ihrem Wissen teilhaben und liefern Belege......"" Wenn er die ersten 15 Jahre nicht auf einer Insel gelebt hat und nicht von einem Pistaziesntrauch gepflückt worden ist, dann wird er zumindestens eine Mutter,Bekannte und Verwandte gehabt haben.";Maraska53
860;5;9;Ach, Sie kennen die Beweggründe des Suizidalopfers? Warum haben Sie dann nicht vorher interveniert?;asklepion
861;5;10;Kennen Sie die Verhältnisse in Afghanistan? Da stehen keine fröhlich winkenden Menschen am Flughafen und holen ihre aus D abgeschobenen Verwandten ab. Die wohnen meistens ein paar Tagesreisen von Kabul entfernt in irgendeiner anderen Provinz und haben wenig Interesse eine Fehlinvestition des Familienklans für ein Ticket nach Europa, der zudem auch noch als Krimineller gebrandmarkt ist (die afghan. Bevölkerung weiss durchaus, das die Abgeschobenen wegen krimineller Delikte im Flieger sitzen) abzuholen.;asklepion
862;5;11;Verantwortlich für die lokalen Verhältnisse sind in erster Linie die Afghanen selbst. D wird das nicht ändern und muss das auch nicht ändern.;asklepion
863;5;12;Und selbst wenn er mutterseelenallein ohne Freunde und Verwandte war ist er doch afghan. Staatsbürger. D steht nicht in der Verantwortung einen vorbestraften Afghanen in seinen Grenzen zu dulden und weiter zu alimentieren.;asklepion
864;5;13;Laut Artikel in der Welt war sein Asylantrag abgelehnt worden. Der Flüchtling hatte zwar Widerspruch eingelegt, diesen jedoch nach über 5 Jahren Verfahrensdauer nicht weiter verfolgt.  Kein weiteres  Interesse oder Resignation wegen offensichtlicher Erfolglosigkeit wegen mehrfacher Straftaten?  Auf jeden Fall ist es günstig,  im Zielland nicht negativ durch Gesetzesverstösse aufzufallen.;jackterrier
865;5;14;"Also hatte er ja wohl eine gute Bildung genossen und sprach wuch fliessend Deutsch und sicherlich auch gut Englisch. Damit hatte er in Afghanistan sicherlich keine katastrophale Chance. Das die Entscheidung hart ist, kann ihn womöglich in eine Depression gestürzt haben, und da hätte man ihm vielleicht Seelsorger zur Seite stellen können. Es gibt leider viele Suizide nach ""Ausrutschern"", ob es eine fehlende Versetzung in der Schule ist, eine polizeinotiz durch falsche Freunde die einem die Wege ins Beamtenleben versperrt. Schlechtes Führungszeugnis für eine Karriere im diplomatischen Dienst, eine Handgreiflichkeit die einem das Sorgerecht kosten kann. Gefängnisstrafe durch Vergehen. Was soll die Lösung sein, ein Auge zudrücken, weil es ja das Leben zerstört? Ich bin ernsthaft an einem Vorschlag interessiert.";Nagenca
866;5;15;"""Verantwortlich für die lokalen Verhältnisse sind in erster Linie die Afghanen selbst. D wird das nicht ändern und muss das auch nicht ändern."" Richtig. Hätten sie sich ihre Invasoren (UdSSR, USA, Deutschland, etc) mal besser rausgesucht, dann wäre das Land jetzt nicht so kaputt. Können wir doch nichts für. Ironie Off. *Facepalm";J.R.M.
867;5;16;?? ??? ????;CHHN
868;5;17;Sie haben entweder nur rudimentäre Geschichtskenntnisse oder gar keine. Invasion Afghanistans durch Deutschland? Wann hat die denn statt gefunden? Wenn Sie den derzeit noch laufenden Bundeswehreinsatz meinen, so handelt es sich hierbei um einen durch NATO Statuten gedeckten Einsatz mit Einverständnis und auf Wunsch der regulären afghanischen Regierung. Ansonsten können Sie gerne Invasoren richtig benennen, die Makedonen unter Alexander d. Gr., die Briten in der Zeit des Empire ectr.;asklepion
869;5;18;Und Sie wissen, ob seine Mutter, Bekannte und Verwandte noch alle am Leben sind? Er wurde nach Afganisthan abgeschoben, nicht nach Bullerbü.;TubularBells
870;5;19;Ob ein 23-jähriger ein Land, das er mit 15 als noch halbes Kind verlassen hat und nach 8 Jahren wiedersieht, als Heimat empfindet, sei dahingestellt. Und ob ihn dann „seine Leute“ und „seine alten Freunde“ erwarten , möchte ich sehr bezweifeln. Woher wissen wir überhaupt, dass es noch lebende Verwandte gibt? Die von der IOM bereitgestellte Unterkunft ist zunächst jedenfalls Indiz für ein sehr einsames „nach Hause kommen“. Wir können also nur spekulieren, und da ist  ein schön gezeichnetes Bild für uns erträglicher als eine sehr harte Landung in einer Wirklichkeit, die ich niemandem wünsche. Schlimm genug, dass es Abschiebungen geben muss, aber sie auch noch zu begrüßen als Lohn  für schlimme Taten: „Eh selber schuld“, finde ich ziemlich abgebrüht. Wir wissen nichts, aber wir konstruieren stattdessen Biografien, damit wir innerlich gut zurechtkommen.;Tante Jane
