;primcmnum;subcmnum;text;username
287;225;0;Ganz besonders bei Personen, wie diesem Afghanen, mit einem langen Strafregister - u.A. Strafanzeigen wg. Diebstahl, Drogenbestitz, versuchter gefährlicher Körperverletzung etc. muss eine schnellst mögliche Rückführung stattfinden ... ein Aufenthalt von insgesamt 8 Jahren ist eine Zumutung für unsere Bürgen und damit unsere Steuerzahler die dies finanzieren.;Goose1
288;226;0;Wer hat eigentlich unsere Grossväter gefragt wenn sie aus russischer Kriegsgefangenenschaft zurückgekommen sind ob sie traumatisiert sind oder nicht. Keiner. Die mussten sich durch Arbeit und Fleiss sich selbst wieder zurechtfinden mit den gegebenen Umständen. Da wird durch die Medien schon ein riesiges Affentheather veranstaltet;wolfsbau
289;227;0;Es ist zynisch den Menschen erst die Hoffnung zu machen,  sie könnten hierbleiben, obwohl die Gesetzeslage anders ist. Da halte ich es für besser, direkt zu sagen, dass sie keine Bleibeperspektive haben und das Land schnell verlassen sollten.;Hipper
290;228;0;Wer jetzt Seehofer, den ich persönlich nicht ausstehen kann, angesichts des Suizids eines Zurückgeführten Zynismus und usw.  vorhält, dem sei gesagt, dass das pharisäerhafte Lamentieren der Linken und Grünen nicht minder ekelhaft ist. Sind es doch sie, die zusammen mit Rechtsanwälten,Pfarrern,Lehrern, Tränern usw. vehement frühe Zurückführungen, die zu Recht durchgeführt werden sollen, mit Aktionen immer wieder verhindern. Wenn dieser Afghane hier 8 Jahre verbracht hat ohne Integration (die er vielleicht gar nicht wollte), dann kriminell geworden ist, gar nicht erst hereingelassen worden wäre, hätte er sich mit Sicherheit in seinem Land wieder zurecht gefunden. Die Lehre aus diesem Fall ist nicht der moralisierende Finger, das politische Ausschlachten derer, die keine Verantwortung tragen, sondern das konsequente abweisen derjenigen, die illegal einreisen wollen.;mimue48
291;229;0;"Zur  Klarstellung: nicht Herr Seehofer hat den jungen Asylbewerber abgeschoben, sondern die  SPD-regierte Hansestadt Hamburg, die sehr restriktiv nur Gefährder, Identitätsverweigerer und Straftäter abschiebt. Zu letzerer Gruppe gehörte der junge Mann, der laut ""die Welt"" bereits kurze Zeit nach seiner Einreise  straffällig wurde.";Jurakäpsele
292;230;0;Dieser Mann hat sein eigenes Schicksal bestimmt. Sowohl als er hier her kam, als er hier war und als er gehen musste. Er hatte zu jeder Zeit die Wahl wo er leben möchte und wie er dies tut. Ihm stand alles offen. Es wurde nichts falsches gemacht. Er hat falsch gewählt.;Alfredo.
293;231;0;"Was sagt denn das ""C"" in ""CSU"" dazu? ›Geht weg von mir, ihr seid verflucht! Geht in das ewige Feuer, das für den Teufel und seine Engel vorbereitet ist! Denn ich war hungrig, und ihr habt mir nicht zu essen gegeben, ich war durstig, und ihr habt mir nicht zu trinken gegeben, ich war ein Fremder, und ihr habt mich nicht aufgenommen, ich hatte nichts anzuziehen, und ihr habt mir keine Kleidung gegeben, ich war krank und war im Gefängnis, und ihr habt euch nicht um mich gekümmert.‹ Dann werden auch sie fragen: ›Herr, wann haben wir dich denn hungrig oder durstig gesehen oder als Fremden oder ohne Kleidung oder krank oder im Gefängnis und haben dir nicht geholfen?‹ Darauf wird er ihnen antworten: ›Ich sage euch: Was immer ihr an einem meiner Brüder zu tun versäumt habt – und wäre er noch so gering geachtet gewesen – , das habt ihr mir gegenüber versäumt.‹ (Mt. 25,41f)";KurtK.
294;231;1;Ich finde es sollte sie Möglichkeit geben, dass so selbstlose Menschen wie Sie für verurteilte Straftäter eine Bürgschaft übernehmen können und diese nicht abgeschoben werden falls Sie sie bei Ihnen zu Hause aufnehmen. Das wird Ihr Leben garantiert bereichern. Ansonsten finde ich es von Ihnen zutiefst unchristlich, dass Sie sich wünschen, dass ausländische Straftäter bei uns bleiben und unsere Gesellschaft weiter schädigen dürfen.;Brindisi
295;232;0;Ich sehe es schon kommen. Jetzt hat sich ein verurteilter Dieb, Räuber und Gewalttäter nach seiner Abschiebung nach Afghanistan das Leben genommen und die Deutschen halten das nicht aus, fühlen sich an seinem Tod mitschuldig. Wie konnte man ihn nur abschieben nach so vielen Jahren, man hätte vorher viel mehr für ihn tun sollen, etc. Anscheinend stehen in Deutschland innere Sicherheit und die Unversehrtheit seiner Bürger ganz unten an und sind weniger wichtig als sich moralisch im Reinen zu fühlen. Kein Wort darüber dass der Mann zurecht abgeschoben wurde weil er Straftäter war, er andere Menschen im Land bestohlen und körperlich verletzt hat. Seine Opfer erwähnt auch keiner, auch nicht die, die er wenn man ihn nicht abgeschoben hätte vielleicht noch in Zukunft geschädigt hätte. Warum ist man in Deutschland in der Beziehung so selbstzerstörerisch, ist man sich selber nichts wert?;Brindisi
296;233;0;Ich kann dieses hin und her nicht mehr lesen. Klar war das eine überflüssige  Äußerung von Seehofer, viele Leute aus Politik, Sport und Wirtschaft schwätzen dieser Tage dummes Zeug. So war es, so ist ist es, so wird es immer bleiben. Ich finde manchmal dieses „empörte Aufgegeile und Hochgeziehe“ an dummen Äußerungen von Menschen schlimmer als manche Äußerung selbst. Jeder muss irgendwie sein Senf dazu geben und noch empörter als der zuvor Empörte sein.  Man übersehe nicht, dass die abgeschobene Person straffällig wegen Diebstahls und Körperverletzung war und entsprechend rechtskräftig verurteilt wurde. Muss man sich jetzt Vorwürfe wegen des Suizids machen? Ist irgendwo zu 100 Prozent bestätigt worden, dass der Suizid alleinig aufgrund der Abschiebung begangen wurde? Abschiebungen gibt es halt und spontan würde mir ein halbes Dutzend in die Medien geratene Beispiele an Abschiebungen aus der Vergangenheit einfallen die emotional weitaus bewegender waren und deren Betroffenen hier voll integriert waren und keinen Mist gebaut haben.  Diese hätten, ohne dies wirklich beurteilen zu wollen, womöglich noch triftigere Gründe für einen Suizid gehabt. Sorry und dann noch zu lesen dass gefordert wird Abschiebungen nach Afghanistan auszusetzen, das entzieht sich meinem Verständnis. Es gibt Millionen andere Schicksale die mehr Mitleid verdient hätten als das in dieser fein servierten Meldung.;Saibots_Meinung
297;234;0;Wenn man jemanden abschiebt, dann sollte man normalerweise versuchen dem die Möglichkeit geben ein Schulabschluß zu machen, ggf. eine Berufsausbildung. Damit sie Hierzulande oder in ihrer Heimat bessere Chancen für einen Job haben. Dabei können diese junge Menschen auch das Leben hier kennenlernen und neue Mut schöpfen. Ich weiss nicht, ob diese Jugendliche die Möglichkeiten haben, eine Schule oder Berufsschule zu besuchen. Ob sie bereit sind diese Möglichkeiten zu ergreifen. Manche Familien schicken ihre Kinder, damit sie hier das Geld verdienen und ihren Familien helfen. Sie wissen nicht, dass es hier so nicht funktioniert, weil sie können sich unser Leben nicht vorstellen.;Shenia
298;235;0;Fehlt nur noch der LiveTicker. Der Asylbewerber ist wahrscheinlich! als Minderjähriger nach Deutschland gekommen und hat deshalb einen besonderen Schutzstatus erhalten. Mit der Volljährigkeit ist das Asylverfahren wahrscheinlich! weitergelaufen und das Asylbegehren wurde abgelehnt. Der Asylberwerber hat Rechtsmittel gegen die Entscheidungen eingelegt und die Ablehnung wurde aufrechterhalten. So können schon einige Jahre vergehen. Manche Kommentatoren tun geradezu so als ob der Innenminister jeden Asylberwerber persönlich kennt und jedes Asylverfahren persönlich begleitet. Die Äußerung des Innenministers war natürlich unnötig.;allesnichts
299;236;0;Natürlich ein tragischer Fall. Natürlich wird das wieder politisch ausgenutzt mit Rücktrittsforderungen und moralischen Agumenten, die ein schlechtes Gewissen erzeugen sollen. Laut statista haben wir in Deutschland jählich über 10.000 Suizidfälle. Welche Minister sollen jetzt alle zurücktreten? Wer das politisch ausnutzt, dem geht es einzig um die eigene Nase. Das ist für mich unmoralisch.;bcool
300;237;0;Tja, Herr Minister, auch wenn das Zufall ist, jetzt klingt Ihre Bemerkung über die 69 Abgeschobenen am 69. Geburtstag nicht nur gänzlich wenig witzig sondern schon zynisch. Haben Sie das wirklich notwendig, als Minister solche komplett unnötigen Witzeleien zu machen und sich damit auf die verbale Stufe vieler Populisten zu stellen? Aber vielleicht sind Sie ja schon einer und wissen es nur selbst noch nicht.;Dum spiro -spero
301;238;0;Es hilft der Blick über den Tellerrand, der Afghane war alles andere als die verfolgte Unschuld:https://www.welt.de/polit... Wer Schutz sucht, sollte sich nicht so aufführen.;Luscinia megarhynchos
302;239;0;"""Zyniker"", ""moralisch überfordert"", ""offensichtlich falsch im Amt"" Vielleicht sollten sich die Moralapostel mal überlegen, was sie hier eigentlich kritisieren. Deutschland hat Gesetze, die Asyl und Schutzansprüche klar regeln. Menschen, die den gesetzlichen Ansprüchen für Asyl und anderweitige Anträge auf Bleiberecht nicht genügen, haben keinen Anspruch darauf, in Deutschland zu bleiben. Diese Abschiebungen sind Durchsetzung von Recht, nicht Rechtsbruch. Einen Politiker, der sich über die Durchsetzung von Recht freut als zynisch, moralisch überfordert oder falsch im Amt zu titulieren? Beste AfD Wahlkampfhilfe. Also behaltet Eure moralische ¨Überlegenheit¨ bitte für Euch. Und was den konkreten Fall des Suizids angeht? Es wurde ein Straftäter abgeschoben, der in Deutschland Körperverletzung begangen hat. Es wird sich über die ¨sprachliche Verrohung¨ von Seehofer geärgert? Noch alle Tassen im Schrank?! Körperverletzung und Diebstahl sind Delikte, die einer tatsächlichen Verrohung etwas näher kommen, als ein Politiker, der sich über die Anwendung und Durchsetzung von Recht und Ordnung freut - auch wenn das zu Lasten von Verbrechern und Migranten geht, die das Asylsystem in Deutschland missbrauchen wollten.";polarapfel
303;239;1;Ich würde Ihrem Beitrag gerne 100 Sterne geben. Auch ich habe langsam den Eindruck, dass die liberalen Kräfte in Deutschland jetzt völlig verrückt geworden sind.;Menschenfreundlich
304;240;0;In einem 6000 Seelendorf haben sich 3 Selbständige umgebracht da sie die Steuern nicht bedienen konnten, Hr. Scholz SPD verlangt noch mehr Steuern  herauszuholen..Und tritt nicht zurück. Ein großes Bedauern, das ein afghanischer Schläger und Dieb, sich nach 8 Jahren der Möglichkeit, sich Arbeit zu suchen und ein Einreiseantrag zu stellen , das alles nicht wahrnahm , in Afghanistan in einem geschützetn Hotel  zu dem Freitot entschloss. Politiker sollen zurücktreten . Das kann nur von Menschen kommen die eben auch Hauen und Klauen für Bagatellen halten ,da sie selbst eben gerne austeilen, wie man beim G20 Gipfel sehen konnte.;Schaf 54321
305;241;0;Bei aller Tragik muss doch festgehalten werden, dass der durch die Hamburger Ausländerbehörde ausgeschaffte Mann ein mehrfach verurteilter Rechtsbrecher war. Wie im Artikel auf Welt online, den ich am Ende verlinke, und der sich auf die Behörden der Hansestadt beruft, wurde der Mann „..rechtskräftig verurteilt wegen Widerstands gegen Vollstreckungsbeamte, versuchter gefährlicher Körperverletzung, Diebstahls und Drogenbesitzes. Darüber hinaus liegen Strafanzeigen gegen ihn vor wegen Raubs, Diebstahls, gefährlicher Körperverletzung und Drogenbesitzes.“ Ausserdem ist im Artikel zu lesen, dass von den ca. 200‘000 Schutzsuchenden aus Afghanistan, die in den letzten 6 Jahren in die BRD kamen, mehr als 82‘000 Gesuche abgelehnt wurden. Ausgereist sind aber nur ca. 6‘000. All die üblichen „Empörten“ sollten doch mal den Ball flachhalten und sich überlegen, ob nicht gerade wegen dem Getue ihrer Parteien die BRD ein derartiges Asyl-Chaos hat. Auch wenn die Äusserungen von Herrn Seehofer nicht gerade glücklich waren (ich kenne den genauen Inhalt und den Zusammenhang, in dem der Minister diese gemacht hat nicht), sind Rücktrittsforderungen fehl am Platz. Seine Vorgänger, die das ganze Chaos verursacht haben, wurden für ihren schlechten Job von den gleichen Personen ja nie kritisiert.https://www.welt.de/polit...;Leser-aus-der-Schweiz
306;242;0;"""Juso-Chef Kevin Kühnert schrieb bei ebenfalls bei Twitter, Seehofer sei ein ""erbärmlicher Zyniker und dem Amt charakterlich nicht gewachsen."" Sein Rücktritt sei überfällig."" Herr Innenminister Seehofer: ""erbärmlicher Zyniker"" würde ich als Beleidigung werten, ich würde deshalb Strafanzeige gegen Herrn Kühnert empfehlen! Herr Juso-Chef Kühnert: Funktionsträger zu beleidigen, die weit über Ihnen stehen und die zumindest behaupten können, dass sie umfängliche Berufserfahrung besitzen und in ihrer Funktion bereits Wesentliches für unser Land geleistet haben, erfordert aus meiner sicht einen sofortigen Rücktritt Ihrerseits!";beka46
307;243;0;"""Bundesinnenminister Horst Seehofer (CSU) hatte sich zufrieden über die unüblich hohe Zahl der Abgeschobenen geäußert"" Dieser Mensch empfindet Genugtuung, wenn mehr Flüchtlinge in Länder abgeschoben werden, in denen keinerlei Lebensperspektive vorhanden ist? Man könnte meinen, dass Seehofer nun endgültig den gesunden Menscherverstand verloren hat.";trittbrettfahrer
308;243;1;Herr Seehofer hat sich darüber gefreut, dass es gelungen ist, mehr Verbrecher und Gefährder aus Deutschland zu schaffen als sonst. Offenbar ist es diesmal nicht zwei Dritteln gelungen, rechtzeitig unterzutauchen. Ich habe mich darüber auch gefreut. Warum? Hamburg ist dadurch sicherer geworden und unser Gesetz wurden in höherem Maße durchgesetzt als sonst.;Menschenfreundlich
309;244;0;Seehofer sollte höchstens zurücktreten, weil zu wenige abgeschoben werden. Und wenn der Mann es in 8 Jahren nicht geschafft hat, sich als nützlich für unsere Gesellschaft zu erweisen, war die Abschiebung längst überfällig und völlig berechtigt.;Podunski
310;245;0;"Es ist immer schlimm, wenn ein Mensch Selbstmord begeht. Dennoch möchte in anmerken, dass anderen Onlinezeitungen entnehmbar ist, dass der Mann wegen Körperverletzungsdelikten vorbestraft war. Auch wegen anderer Dinge. Man muss hier auch die Opfer seiner Gewalttaten mit einbeziehen. Die kann man ja mal fragen, was sie von der Sache halten. Ich denke, niemand hat den Mann zu der Ausübung von Gewalt gezwungen. Es war seine Entscheidung sich in seinem Gastland so zu benehmen. Eine fatale Fehlentscheidung, wie nun deutlich wird. Darauf zu setzen, dass sich die anderen ihm gegenüber im Gegenzug aber anständig benehmen ist in meinen Augen unredlich. There is no free ride. Schutz, Fürsorge und Aufnahme gegen Achtung der Gesetze und Regeln. Oder um es mit Schiller zu sagen ""Verrat trennt alle Bande"".";Sapralott
311;246;0;"Vor 8 Jahren. Wenn man googelt, findet man solche Meldungen: ""2010 ist das blutigste Jahr des Afghanistan-Einsatzes – bereits 600 Nato-Soldaten ließen ihr Leben. Vergangenes Jahr waren es 521."" Hätte ich als Vater damals dort gelebt, hätte ich meine Kinder in Sicherheit gebracht. Leider war der Junge hier in Deutschland nicht in Sicherheit. Sonst wäre er nicht auf die schiefe Bahn geraten. Man fragt sich, wann endlich unsere Behörden mal reformiert werden. Sie schaffen ihre Arbeit nicht. Egal wohin man guckt. Mir als Prozess- und Qualitätsmanager in der Industrie schlackern da jedenfalls die Ohren, wenn ich mir die Qualität der Behördenarbeit angucke. Und darum geht dieser Tote auch auf die Kosten der Behörden, die in den vergangenen 8 Jahren nur Murks gebaut haben. Denn: sollte ein 15jähriger nicht Mo-Fr 8-16 Uhr die Schulbank drücken und nach einem Schulabschluß Mo-Fr 7-16 Uhr eine Ausbildung machen? Dann hätte er vermutlich keine Straftaten begangen. Und wenn Flüchtlingen von Anfang an gesagt werden würde (also auch den 1 Million Syrern ab 2015), dass sie 100%ig wieder in ihre Heimat abgeschoben werden, sobald das ohne Gefahr für Leib und Leben möglich ist, und nur (!) ganz wenige eventuell hierbleiben dürfen, die (1) keinerlei Straftaten begangen haben, (2) die deutsche Sprache gut sprechen, (3) einen Schulabschluß haben, (4) ein Ausbildung oder ein Studium erfolgreich abgeschlossen haben und (5) einen Job haben ohne auf Sozialtransfers angewiesen zu sein - tja dann...";Wolfgang_K.
312;247;0;Ich versteh die ganze Aufregung nicht. Scheint ein bedauerlicher Einzelfall zu sein, passiert in Deutschland jährlich tausendfach, ohne überregionale Berichterstattungen. Die Rücktrittsforderungen sind meiner Meinung nach ungerechtfertigt. Zumal noch nicht offiziell bestätigt wurde, dass es sich tatsächlich um Suizid handelt.;StraightDave
313;248;0;Jeder Selbstmord ist überflüssig und unnötig, egal aus welchen Grund. Aber was soll bitte die Nachricht über einen Selbstmord in Kabul in der ZEIT? Verstehe ich nicht. Es sei denn, man will der Nachricht eine nicht ganz neutrale Bewertung mitgeben und eine entsprechende Stimmung verursachen. Der abgeschobene Afghane war ein Mehrfachstraftäter, der bald nach seiner Ankunft straffällig wurde. Nur zur Information. Die ZEIT kann ja auch demnächst über Suizide berichten, die wegen Jobverlust aufgrund von Rationalisierungen verübt wurden oder weil durch die Bank der Kredit gekündigt wurde. Aber diese Suizide haben ja nur eine Depression als Ursache - während dieser vom Staat herbeigeführt wurde.;Philomena1985
314;249;0;"""Nach Angaben des Bundesinnenministeriums (BMI) und aus dem Flüchtlingsministerium in Kabul hatte der junge Mann in Hamburg gelebt. Ein BMI-Sprecher sagte, er sei wegen Diebstahls und Körperverletzung mehrfach rechtskräftig verurteilt worden."" Na ja, einen Suizid wünscht man natürlich niemandem, von ""erfolgreicher Integration"" des jungen Mannes in unsere Gesellschaft kann wohl allerdings auch nicht gesprochen werden und es ist die Frage, ob so eine gesteigerte Aggressionsbereitschaft (auch gegen sich selber) nicht möglicherweise früher oder später auch zu gesteigertem Agressionsverhalten gegen Unschuldige geführt hätte, wie ja bereits mehrfach in anderen Fällen in der jüngeren Vergangenheit bei uns geschehen (z.B. FR - Dreisammord oder Kandel oder Siegau-Auen usw.)?!";beka46
315;250;0;"""Der Mann sei in Deutschland rechtskräftig wegen Diebstahls und Körperverletzung verurteilt gewesen."" Das ist nach der Rechtslage (§ 54 AufenthG) ein Ausweisungsgrund. Die Aufregung gegen Seehofer ist populistischer Unsinn. Dass umgekehrt von Asylantragsteller schwere Straftaten begangen wurden, hat auch den vorigen Innenminister nicht zum Rücktritt veranlasst.  Irgendwann kommt auch für diese Kanzlerin die Situation, da muss sie im Interesse des Staates und der ihn bildenden Bürger unpopuläre Entscheidungen fällen. Solche ""tragische"" Situationen hat sie bisher immer geschickt vermieden. Vielleicht ist jetzt der Punkt gekommen, wo sie nicht mehr ausweichen kann. Wenn sie keine klare Haltung zeigt, wird sie endgültig versagt haben. (Wenn der Staat beginnen würde, sich mit Selbstmorddrohungen erpressen zu lassen, dann ""Gute Nacht"". Kanzler Schmidt hat sich richtigerweise auch nicht von Morddrohungen erpressen lassen - und da ging es um Unschuldige.)";Nord-Nordwest
316;251;0;Es bleibt festzuhalten, dass der Mann rechtlich absolut korrekt abgeschoben wurde. Da kann dem Innenminister kein Vorwurf gemacht werden. Das er dann Suizid begangen hat ist ein trauriger Einzelfall. Auch dafür kann man das Innenministerium nicht verantwortlich machen.;Brechmittel
317;252;0;Begeht jemand Verbrechen sollte er abgeschoben werden. Dass der Abgeschobene sich umgebracht hat ist tragisch, kann aber im Umkehrschluss nicht heißen, man darf einen Verbrecher nicht abschieben, er könnte sich umbringen.;Christina1972
318;253;0;Suizid ist fürchterlich. Auch der des Gatten des Mannes, welcher im Juli 2017 in einem Hamburger Supermarkt von einem 26-jährigen Syrer erstochen wurde. Darüber allerdings gab es dann keine großen Meldungen mehr... alles geht schnell vergessen...;Gabháinn Ó Raghallaigh
319;253;1;Das wusste ich nicht. Wie traurig.;Oberlausitzerin
320;254;0;Der Fakt dass ihn in Afghanistan keine Großfamilie empfangen hat ist merkwürdig. Ich kenne diesen Teil der Welt durch eigene Familie und normalerweise macht die engere Familie bereits 300 Personen aus - das ist dort das Sozialsystem. Wenn keiner mit ihm etwas zu tun haben will bedeutet das das es bereits zuvor in der Heimat extrem ernste Probleme gab. Solche Fälle gibt es überall und das Problem liegt in der Person nicht im Aufenthaltsort.;Frank Zappa
321;255;0;"Seehofers Bemerkung wg. 69. Gebutstags  war ""nebbe de Kapp"", aber wenn der junge Mann sich in D. vernueftig , dh. gestsetzeskonform verhalten haette, waere er nicht abgeschobene worden. Seehofers Gebutstag hin oder her.";Florina
322;256;0;Verbrecher haben in diesem Land nichts zu suchen und können abgeschoben werden.  Ist auch gesetzlich so verankert.;Chris W. Zwo
323;257;0;Guten Tag, Ehrlich gesagt: ich bin entsetzt, wie hier ein Suizid instrumenstalisiert wird. Mit derselben Berechtigung liesse sich konstruieren, dass durch den Suizid deutlich werde, dass es sich um einen Gefährder handelte. Schliesslich gibt es viele, die psychisch Kranke aus dem Grund als Risiko sehen und eine bessere Überwachung fordern. Dann hätten wir also womöglich Glück gehabt. Nein, diese Art der Verwurstung individuellen Leids ist einfach nur abscheulich.;Hansering
324;258;0;"""Der Mann sei in Deutschland rechtskräftig wegen Diebstahls und Körperverletzung verurteilt gewesen."" http://www.tagesschau.de/... ""Vergangene Woche war der mehrfach verurteilte Straftäter nach Kabul abgeschoben worden.""  Es gibt härtere Strafen als in sein Heimatland abgeschoben zu werden und in Freiheit zu leben. In Afghanistan leben noch genug Menschen unter den hiesigen Bedingungen, die mit Sicherheit es mehr verdient hätten, in Deutschland Asyl zu bekommen. Der junge Mann hatte in 8 Jahren seine Chance, sogar mehrere, er hat sie vertan und sein Gastrecht aufgrund seines Verhaltens verwirkt. Seinen Tod hat er frei gewählt.";Glücksmoment
325;259;0;"Was die von der Zeit Redaktion verschwiegen wird. Es handelt sich bei dem abgeschobenem Asylbewerber um einen mehrfach verurteilten Straftäter. Jetzt wird der ""Selbstmord"" instrumentalisiert um gegen Abschiebungen Stimmung zu machen... Genau diese einseitige Berichterstattung führt zur weiteren Spaltung der Gesellschaft. Wahrscheinlich wird mein Post eh nicht durch die Zensur kommen. Artikel aus der WELT:https://www.welt.de/polit...";Konfuzius II
326;260;0;Und,hat Seehofer schon den Kalauer dazu rausgehauen?;Fiesotop
327;261;0;Das ist tragisch, so wie die Morde die hier in Deutschland begangen wurden. Hätte es bereits in 2011 die Transit Zone gegeben, so wäre den Betroffen wohl das Leid erspart geblieben und sie würden heute noch leben.;Heinrich Heinemeier
328;262;0;"""Menschen wissentlich ertrinken zu lassen sehen Sie als Teil der Lösung des Flüchtlingsproblems. Ab sofort sind die bisher 1400 Toten im Mittelmeer auch Ihre Toten. Sowohl dieses Ertrinkenlassen als auch das Verfrachten von Menschen in libysche Lager, in denen sie ausgebeutet, vergewaltigt und sogar getötet werden, ist ein Verrat an den Werten, für die wir in Deutschland und Europa stehen. Der zweite Grund für mein Schreiben ist Ihre bei der Vorstellung des ""Masterplans"" unverhohlen geäußerte Freude über ein unverhofftes und von Ihnen ""nicht bestelltes"" Geschenk zum 69. Geburtstag, die Abschiebung von 69 Flüchtlingen nach Afghanistan."" (Brief von Renate Schmidt an Horst Seehofer veröffentlicht in der SZ)";St.Expeditus
329;263;0;Der abgeschobene Afghane war ein mehrfach verurteilter Straftäter. Die Rückführung in seine Heimat war darüber hinaus mangels Aufenthaltsstatus geboten und soweit ich sehe auch rechtlich korrekt umgesetzt. Auch in deutschen Gefängnissen kommt es immer wieder zu Suiziden. Macht sich die Links-Grüne Openboarder-Lobby (die SPD lasse ich mal außen vor, da die eh keine eigene Meinung haben) deshalb auch für die Schließung deutscher Gefängnisse stark?;Ichglaubnix
330;264;0;"Würde mir wünschen, dass man das Geschehen, sachlich und ohne das übliche Links/Rechts-Hickhack betrachtet, den damit ist niemanden geholfen. Es wäre bestimmt besser für alle Beteiligten gewesen, wenn die Asylgrundprüfung ohne die neu-deutsche Prokrastination (""Aufschieberitis"") verlaufen wäre. Genau das ist es, was diese langen Asylverfahren befördert.";meierdirks
331;265;0;Abgeschobener Afghane begeht in Kabul Suizid... Jihad, jihad... Assül!;batubintang
332;266;0;in anderen Blättern ist zu lesen, das es sich um einen Straftäter handeln soll, der mehrere Taten begangen hatte. Ferner sollte er unter Depressionen gelitten haben, aber es ging nicht hervor wann die Auf getreten sind. Ein Freitod ist halt immer tragisch.;Stammuser
