;primcmnum;subcmnum;text;username
506;419;0;"Herr Seehofer gehört jetzt sicher nicht zu den intelligentesten Menschen unter der Sonne. Als Sympathieträger kommt er für mich auch nicht in Frage. Das vorweg. Ein Asylbewerber, der durch die Instanzen hier abgelehnt wurde, der sich augenscheinlich eher auf kriminelle Handlungen spezialisiert hat und da dann auch mehrfach in Erscheinung trat - gehört sicher nicht zu den intelligentesten Menschen unter der Sonne. Und auch hier kommt mir das Wort ""Sympathieträger"" nicht passend vor. Der bayerische Unsympath hat aber die Aufgabe übernommen, als Innenminister sich auch darum zu kümmern, dass geltendes Recht umgesetzt wird. Und dummerweise ist er nun der, der nach diese Aufgabe nach langer Zeit mal ein bisschen ernster nimmt. Abgelehnte Asylbewerber und Flüchtlinge sind ausreisepflichtig. Insbesondere dann, wenn das von allen angerufenen Instanzen so bestätigt wurde. Afghanistan gilt als sicher (das darf man von Region zu Region anders sehen, aber ganz Afghanistan  ist sicher nicht total unsicher). Primär abgeschoben werden Straftäter - und das war nun dieser junge Mann ganz eindeutig. Wenn er dann mit den Handeln seines Tuns nicht klar kommt, dann ist das tragisch. Es ändert aber nichts daran, dass ich weder rechtlich noch menschlich etwas an seiner Ausweisung aussetzen kann. Chancen hatte er im Rahmen der Jungendfürsorge sicher genug. Und die ersten Straftaten mag man noch mit jugendlicher Dummheit beschreiben können. Er war aber wohl eher so was wie ein Dauerbrenner.";binkeinwicht
507;419;1;"Und noch ein Zitat - dieses Mal von stern.de: ""Sein Vorstrafenregister sei auch der Grund, warum Jamal M. in der vergangen Woche in dem Abschiebeflieger von München nach in die afghanische Hauptstadt Kabul gesessen habe. Abschiebungen nach Afghanistan sind wegen der Sicherheitslage vor Ort umstritten.  Nach dem vorübergehend verhängten Stopp von Abschiebungen nach Afghanistan würden verurteilte Straftäter, Gefährder und Identitätsbetrüger inzwischen wieder zur Ausreise dorthin gezwungen, so der Sprecher weiter. Asylantrag von Jamal M. abgelehnt M. war den Angaben zufolge im August 2011 nach Deutschland eingereist, seinen in Hamburg gestellten Asylantrag habe das Bundesamt für Migration und Flüchtlinge im Juni 2012 abgelehnt. Daraufhin habe der Afghane Klage beim Hamburger Verwaltungsgericht eingereicht und fortan mit einer Aufenthaltsgestattung in Deutschland gelebt, so der Sprecher des Einwohner-Zentralamtes der Hansestadt Im Jahr 2017 sei das Verfahren vor dem Verwaltungsgericht demnach ""wegen mangelnder Mitwirkung des Klägers"" eingestellt worden. Die Aufenthaltsgestattung sei daraufhin erloschen und wegen des seinerzeit geltenden Abschiebestopps durch eine Duldung ersetzt worden - zuletzt sei er wegen der veränderten Lage ""vollziehbar ausreisepflichtig gewesen"". "" Der junge Mann hat es also nicht mal mehr für nötig befunden, selber an der Gewährung des von ihm beantragten Aufenthaltsrechtes mitzuwirken. Da muss die Überzeugung ""Mir geschieht eh nichts!"" vorherschen.";binkeinwicht
508;420;0;Nazi-Jargon, Nazi-Greuel und Nazi-Methoden gehören zwar zur christlich-abendländischen Geschichte, aber nicht zur christlich-abendländischen Kultur! Das verwechseln mitunter maßgebliche Protagonisten von AfD und „C“SU! Und tragen so einerseits zur Verrohung in der Gesellschaft und andererseits zu deren Spaltung bei! Das kann man auch hier in diesem Forum erkennen, wo viele gar nicht wissen, was die christlich-abendländische Kultur ausmacht, die sie aber vorgeben zu verteidigen.;SigisRue
509;421;0;Ich mag den Seehofer nicht besonders, aber für den Selbstmord eines abgeschobenen Afghanen kann erwirklich nichts. Es ist bisher wohl auch nicht bekannt, zumindest nicht erwähnt, warum der Abgeschobene Suizid begangen hat.;RudolfBayerl
510;422;0;Direkt ins Stammhirn der Stammwähler. Das ist nicht der alte Seehofer, sondern eine Art neuer bayerischer Dschihad. Merkels bewährtes Schweigen ist unerträglich, wenn die Grundwerte der Gesellschaft für Knalleffekte verscherbelt werden. Sie ist zu sehr beschädigt und sollte abtreten, aber vorher sollte sie sich ihre Würde bewahren und Seehofer rausschmeißen. Die Sonne geht morgen auch ohne sie wieder auf und ohne ihn erst recht.;Marioce
511;423;0;Hier gilt mal wieder: Reden ist Silber, Schweigen ist Gold! Kommentare zu einem Suizid sind überflüssig.;INGEN79
512;423;1;"""Kommentare zu einem Suizid sind überflüssig."" Da haben Sie in Prinzip recht. Aber die ersten, lautesten und politisch eindeutig geleiteten Kommentare hierzu kamen dieses Mal nicht von der rechten Seite.  Bei Einzelfällen, die in die andere Richtung gehen, wird Politikern, die diese für die Unterlegung ihrer Argumente nutzen, standardmäßig vorgeworfen, sie würden den Fall xy für ihre Zwecke ""instrumentalisieren"". Was hier passiert, ist nicht anders. Interessierte Kreise instrumentalisieren den Fall, um Seehofer eins drüber zu geben und gegen Abschiebungen im Allgemeinen mobil zu machen.";Spencer2
513;424;0;Dafür zu sorgen, dass Abschiebungen von kriminellen Mehrfachtätern durchgeführt werden, ist die eine Sache.  Daran ist meiner Meinung nach nichts auszusetzen. Es ist die Aufgabe Seehofers, für Deutschlands innere Sicherheit zu sorgen. Hier aber seinen Geburtstag ins Spiel zu bringen und nahezulegen, die Abschiebung von 69 Menschen sei ein besonders hübsches Geschenk auf dem Gabentisch vom Horst, ist sehr befremdlich. Wen interessiert es überhaupt, dass Seehofer Geburtstag hat - mich jedenfalls nicht. Grinsend und strahlend den eigenen Geburtstag zu erwähnen in einem solchen Zusammenhang ist infantil, instinktlos und völlig daneben. Für mich bleibt es dabei: Seehofer und auch Angela Merkel sollten in nicht allzu ferner Zukunft ihre Sessel räumen. Ihre Zeit ist vorbei.;Frau Hoffmann
514;425;0;"Seehofer ist natürlich nicht direkt verantwortlich für den Tod dieses Menschen. Aber seine klammheimlich, nein seine öffentlich zelebriert Freude über 69 Abgeschobene an seinem 69. Geburtstag ist abstoßend und entlarvend zugleich. Wenn Seehofer, immerhin Parteichef einer angeblich ""Christlichen"" Partei, sich über solcherart ""Geschenke"" öffentlich diebisch freut, dann sagt das viel über ihn und seine Partei. Eigentlich alles, was man darüber wissen muss.";Lumpaci
515;425;1;Wieso ist die Freude über eine gelunge Abschiebung von Kriminellen abstoßend ? Das ist doch eine gute Nachricht. Soll Seehofer die Nachricht etwa unter Tränen der Anteilnahme vortragen ?;Spencer2
516;426;0;Bedauerlich? Weil es jetzt nur noch 68 und nicht 69 Gebutstagsabgeschobene sind??;Klaus Bärbel
517;427;0;Das passt zur Ethik Seehofers. Die Hamburger waren und sind schuld.  Und Merkel lebt weiter ihr politisches Dasein mit diesem schückenden Beiwerk.;ameliebott
518;428;0;Der Populismus der etablierten, linken Parteien scheint aber gute Wirkung zu erzielen... wie man auch den Trichter kommen kann, den (ich mag Ihn auch nicht) Herrn Seehofer den bedauerlichen Suizid, eines abgelehnten Asylbewerber in die Schuhe schieben zu wollen verwundert aber nun doch etwas. Ich hätte nie gedacht, dass der Selbstmord eines jungen Mannes derartig von den etablierten Parteien (rein populistisch) instrumentalisiert wird...  Man sollte nur nicht vergessen, dass die meinungen hier auf die-Zeit-Online nicht representativ für alle Bürger dieses Landes ist. Ich finde das Verhalten von Grün & Co. jedenfalls abstoßender als den dämlichen Spruch vom Seehofer. Festigt meine Meinung, dass man von den etablierten Parteien nichts mehr erwarten darf, schon garnicht ein rationales Angehen der aktuellen Probleme.;Grimbold Unfried
519;429;0;Wo ist der Aufschrei der gleichen Politiker, die nun vor Mitleid mit dem jungen Afghanen zerfließen, wenn sich junge Deutsche aus Verzweiflung umbringen?  Allein im Jahr 2015 (letzte verfügbare Zahlen) waren es 6 Jungen und 13 Mädchen im Alter von 10-15 Jahren!! 196 Jugendliche im Alter von 15-20 Jahren sahen keinen Grund mehr weiter zu leben. INSGESAMT  BEGEHEN  JEDES JAHR ca. 10.000 (ZEHNTAUSEND !!) MITMENSCHEN EINSAM UND ALLEIN IN DEUTSCHLAND SELBSTMORD. Und das ist keine Schlagzeile und keine Untersuchung und keinen gesellschaftlichen Aufschrei wert....;ein mitdenker
520;429;1;Das ist wirklich gut mitgedacht! Ironie off;one of billions
521;430;0;Die Situation ist wirklich bedauerlich. Allerdings gebe ich weder Hr. Seehofer noch sonst einem die Schuld. Wenn ein Flüchtling in einem Land, welches sich seiner Probleme angenommen hat, kriminell wird, muss er wieder in das Land zurück, wo er her kommt. Suizid ist nur ein Ergebnis seiner eigenen Taten! Wir bringen es unseren Kindern bei, bei Gastgebern anständig zu sein. Das ist das kleine 1x1 der Benimmregeln. Diebstahl und Körperverletzung gehört nicht dazu!;Rocketman9882
522;431;0;Würde man Seehofers Masterplan folgen gäbe es solche Vorfälle nicht mehr.;Wyllemora
523;432;0;Als Bundesminister ist Seehofer untragbar geworden. Dieses Zitat ist nur noch ein weiteres Quantum in dem bereits übervollem Glas der Zumutungen. Lange geht das nicht mehr gut.;Sinnkrise
524;433;0;Vielleicht hilft es, ein Bespiel auf der persönlichen Ebene zu wählen. Wenn sich jemand aus einer Beziehung löst, in der der Partner ihn ausgenutzt hat und gewalttätig geworden ist, und dieser Partner begeht danach Selbstmord: Würde man diesen jemand beschuldigen?  Sicher nicht. Hier sollte es auch so sein.;bevoreszuspätist
525;434;0;Entfernt. Doppelpost, danke für den Hinweis. Danke, die Redaktion/ee;bevoreszuspätist
526;435;0;Die ehemalige Bundesministerin Schmidt hat noch einmal ausdrücklich darauf hingewiesen, dass die bisher 1400 Toten im Mittelmeer ab sofort auch Seehofers Tote sind:https://www.focus.de/poli...;Turnmutter
527;435;1;Das ist pervers, was die gute Frau Schmidt hier von sich gibt.;mf2016
528;436;0;Man weis ziehmlich wenig über den Unglücklichen und kocht seine eigene Suppe.  In Deutschland begehen jedes Jahr über 10Tsd. Menschen Selbstmord. Das ficht die Moralität des Hofreiter nicht so an. Jedenfalls ist mir keine Äußerung von ihm dazu bekannt.;Alfons Wedelmann
529;437;0;Da der Abgeschoben mehrfach vorbestraft war, muß man doch die Frage zulassen, wann denn jemand sein Aufenthaltsrecht verwirkt hat. Wenn er es in 8 Jahren nicht vermochte hier heimisch zu werden und sich gesetzestreu zu verhalten, hat er in Deutschland nichts zu suchen. Das er in Afghanistan Selbstmord begangen hat ist eine ganz andere Geschichte und nicht denen anzulasten die die  Abschiebung veranlaßt haben.;Kurt Anhalt
530;438;0;"""Schon bald nach seiner Ankunft"" (2011, d.h. mit 15) ""wurde er straffällig. Wie die Hamburger Ausländerbehörde WELT mitteilte, wurde er rechtskräftig verurteilt wegen Widerstands gegen Vollstreckungsbeamte, versuchter gefährlicher Körperverletzung, Diebstahls und Drogenbesitzes. Darüber hinaus liegen Strafanzeigen gegen ihn vor wegen Raubs, Diebstahls, gefährlicher Körperverletzung und Drogenbesitzes."" https://www.welt.de/polit... Nur nachrichtlich zur Information, welche Kosten für die öffentliche Hand bei minderjährigen unbegleiteten Flüchtlingen über die Jahre so auflaufen können: https://www.merkur.de/lok...";Just for Fun
531;439;0;"Empörungsrituale der üblichen Verdächtigen.... Als ob Seehofer oder die Hamburger Behörden daran jetzt Schuld wären. So etwas mit umgekehrten politischen Vorzeichen würde man sofort als ""Instrumentalisierung von Toten für die eigene politische Agenda"" zu recht diskreditieren.";NiklasMo
532;439;1;"Der Vorwurf der ""Instrumentalisierung"" ist anscheinend immer nur in eine Richtung legitim. Genau wie der Vorwurf des ""Ängste schüren"".";Spencer2
533;440;0;Es wäre schön gewesen, wenn Herr Seehofer auch diese dumme Zahlenanalogie bedauert hätte. Aber vielleicht gehört er zu denen, die das Eingeständnis eines Fehlers als Schwäche auslegen müssen.;Talmi
534;441;0;https://www.watson.ch/wis... unwillkürlich fiel mir diese grauenhafte Geschichte die an Zynismus kaum zu überbieten ist, als ich die  Aussage von Herrn Seehofer mit einem selbstzufriedenen Lächeln ums Lippen vorgetragen, gesehen habe. Es geht hier nicht darum, ob der Abgeschobene sich schuldig gemacht hat. Viele Abgeschobene machen sich schuldig obwohl es ihnen klar ist, dass sie damit ihr Bleiberecht gefährden. Und darüber hinaus auch sogar Menschenleben. Ich gebe zu: da muss ich leider zustimmen, auch wenn ich weiss, alles müssten wir im globalen Kontext sehen! Aber das ist ein anderes Thema. Die undurchdachte Aussage von Herrn Seehofer der als Innenminister Deutschlands in die Weltgeschichte einzieht ist kein Lapsus Linquae (Ausrutscher der Zunge beim Sprechen) sonder Lapsus Gehirns. Oder ganz im Gegenteil? In beiden Fällen ist es unwürdig gegenüber seinem Land.;mitsprache
535;442;0;Ich könnte versuchen es Ihnen zu erklären aber ich vermute dass ihre Voreingenommenheit und Charakter würden ein Verstehen ihrerseits verhindern;Braver Bürger
536;443;0;Das ist sehr bedauerlich. Allerdings sind wir ein Rechtsstaat und dort gibt es Gesetze. Gesetze aufgrund derer der junge Mann wegen Straftaten verurteilt und Gesetze wegen der er abgeschoben wurde. Vielleicht sollte man sich da schon überlegen, warum ein Asylverfahren 8 Jahre dauert. Allerdings hat der junge Mann anscheinend vergessen, dass er nur Gast hier war. Und ich denke mit 15 Jahren ist einem sehr wohl klar, dass man eventuell keine Bleiberrecht erwirkt.;chrioll
537;443;1;"""Vielleicht sollte man sich da schon überlegen, warum ein Asylverfahren 8 Jahre dauert."" 7 Jahre hat es von der Einreichung der Klage bis zu einem Urteil gedauert. Da liegt der eigentlich Skandal. Man stelle sich vor, das wäre generell der Fall. Wenn man z.B. nach einer Kündigung 7 Jahre auf ein Urteil des Arbeitsgerichts warten müsste.";Spencer2
538;444;0;Selbstverständlich ist so ein Selbstmord tragisch, aber wurde wegen der selbstmorde in der Bundeswehr nur einmal die Wehrpflicht in Frage gestellt ? https://www.bundeswehr.de...;FritzMar
539;445;0;Das Verfahren, um einen Kriminellen abzuschieben, dauerte acht Jahre. Bei einer zügigeren Abwicklung dieses Falls würde der Mann möglicherweise noch leben.  Das ist doch der eigentliche Skandal, dass diese überlangen Verfahrensdauern in Deutschland die Betroffenen in einem vieljährigen Wartezustand halten. Die deutsche Obrigkeit maßt sich hier Verfügungsrechte über die Zeit von Einzelmenschen an, die ein unerträgliches Maß an Fremdbestimmung beinhalten.;eustochium
540;446;0;Den Hinweis auf seinen Geburtstag hätte sich S.H. sparen können. Den Jubel über 69 Rückgeführte und die ungewöhnlich hohe Zahl bei derzeit 82.000 ausreisepflichtigen Afghanen aber auch. Das wären noch 123 Flüge... nur für Afghanen.;refrigerator
541;447;0;"Ein tragischer Fall. Nach einpaar Flugstunden wird aus Reichtum Armut, aus Frieden Krieg und aus Hoffnung Verzweiflung. Das ist nicht leicht zu ertragen.  Auch wenn ich Seehofers Politik nicht ünterstütze, kann ich persönlich nicht so weit gehen, ihm diesen Selbstmord anzuhängen. Vor allem weil ... ""Der Mann sei in Deutschland rechtskräftig wegen Diebstahls und Körperverletzung verurteilt gewesen.""";Nutzer X
542;448;0;Nachdem ich mir das Video mit dem deutschen Innenminister Seehofer angesehen habe und den Vergleich von 69 abgeschobenen Afghanen und seinem 69. Geburtstag nicht so ganz nachvollziehen konnte (ein etwas verunglückter Scherz) blieb ich bei der Bemerkung „10 Personen mit 52 Personen als Begleitpersonal ausgeflogen“ stellt sich bei mir die Frage, weshalb benötigt man mehr als 5 Begleitpersonen um eine Person außer Landes zu verweisen? Eine Antwort auf diese Frage würde mich schon irgendwie interessieren. Ist das notwendig gewesen und wenn ja weshalb? Oder ist das einfach nur Verschwendungssucht?;Charlotte van H.
543;449;0;"Wer  seine ""Schutz-und Gastgeber"" bestiehlt und körperverletzt hat sein Asylrecht verwirkt - überall auf der Welt.";Wyllemora
544;450;0;Es verwundert wenig, dass aus einer bestimmten Ecke Seehofer für den Selbstmord verantwortlich gemacht wird. Das Fazinierende daran ist, dass justament politische Vertreter aus dieser Ecke die Abschiebung veranlaßt haben ! Noch weitere Fragen ? Ist bestimmten Politikern jedes Mittel rech, den politischen Gegner zu verunglimpfen?;Realistundträumer1
545;451;0;Natürlich ist das bedauerlich. Aber dafür ist Seehofer doch nicht verantwortlich. Jeder hat eine Wahl. Wenn hier ein Arbeitsloser sich aufhängt wird der Chef der Firma auch nicht an den Pranger gestellt.;sldz
546;1;2;Der Kommentar, auf den Sie Bezug nehmen, wurde bereits entfernt.;xAVIATORx
547;1;3;Der Kommentar, auf den Sie Bezug nehmen, wurde bereits entfernt.;Steven_Patrick
548;1;4;Der Kommentar, auf den Sie Bezug nehmen, wurde bereits entfernt.;Blork
549;1;5;Der Kommentar, auf den Sie Bezug nehmen, wurde bereits entfernt.;strixaluco
550;1;6;Der Kommentar, auf den Sie Bezug nehmen, wurde bereits entfernt.;elbinsel
551;1;7;Der Kommentar, auf den Sie Bezug nehmen, wurde bereits entfernt.;Otto Normal
552;1;8;Der Kommentar, auf den Sie Bezug nehmen, wurde bereits entfernt.;HeyDa
553;1;9;Der Kommentar, auf den Sie Bezug nehmen, wurde bereits entfernt.;Tado HBS
554;1;10;Der Kommentar, auf den Sie Bezug nehmen, wurde bereits entfernt.;IrgendsoenTyp
555;1;11;Der Kommentar, auf den Sie Bezug nehmen, wurde bereits entfernt.;klaurot
556;1;12;Der Kommentar, auf den Sie Bezug nehmen, wurde bereits entfernt.;BeLena
557;1;13;Der Kommentar, auf den Sie Bezug nehmen, wurde bereits entfernt.;Grimbold Unfried
558;1;14;Der Kommentar, auf den Sie Bezug nehmen, wurde bereits entfernt.;klaurot
559;1;15;Der Kommentar, auf den Sie Bezug nehmen, wurde bereits entfernt.;IrgendsoenTyp
560;1;16;Der Kommentar, auf den Sie Bezug nehmen, wurde bereits entfernt.;Erdenmond
561;1;17;Der Kommentar, auf den Sie Bezug nehmen, wurde bereits entfernt.;elbinsel
562;1;18;Der Kommentar, auf den Sie Bezug nehmen, wurde bereits entfernt.;ZurGleichenZeit
563;1;19;Der Kommentar, auf den Sie Bezug nehmen, wurde bereits entfernt.;demarciana
564;1;20;Der Kommentar, auf den Sie Bezug nehmen, wurde bereits entfernt.;Otto Blech
565;1;21;"""Da sollte man eher die straffällig gewordenen abschieben und nicht die gut integrierten.""  Der Abgeschobene war straffällig geworden. Mehrmals.";John Farson
566;1;22;"Über ""gut integriert"" kann man viel spekulieren. Der Betreffende war aber wohl durchaus straffällig geworden. Zitat aus dem Artikel: ""Der Mann sei in Deutschland rechtskräftig wegen Diebstahls und Körperverletzung verurteilt gewesen. """;13onyx37
567;1;23;Im Text steht: Der Mann sei in Deutschland rechtskräftig wegen Diebstahls und Körperverletzung verurteilt gewesen. Also hat man einen straffällig gewordenen abgeschoben.;DrShoe
568;1;24;Wenn er 8 Jahre hier war, ist das dann aber irgendwann unser Problem, kein afghanisches.;strixaluco
569;1;25;"""Wenn er 8 Jahre hier war, ist das dann aber irgendwann unser Problem, kein afghanisches."" Wenn jemand bei Ihnen in der Wohnung Gast ist, Sie anfängt zu schlagen und zu beklauen, würden Sie ihn dann nicht aus der Wohnung werfen, sondern ihn als Ihr Problem betrachten?";Richtigsteller1
570;1;26;Ganz genau, eigentlich demonstriert so ein fall, so traurig wie es ist, das wir leider nicht ausreichend integrationsarbeit leisten. Niemand wählt freiwillig den Diebstahl, heranwachsende als mutprobe vielleicht ausgenommen. Gewalt und Körperverletzung haben immer unterschiedliche auslöser von denen einer Hoffnungslosigkeit ist.;Til-man
571;1;27;Die geht bisher noch von beiden Seiten aus. Wenn eine Seite nicht will, wird das nichts mit der Integration. Und leider finden Sie eben auch immer wieder solche, die hier ankommen und eben nicht bereit sind sich zu integrieren. Neubürger stehen in der Bringschuld, wenn es um den Integrationswillen geht. Der muss natürlich auch vom Migrationsland ausgehen und hier müssen natürlich auch entsprechende Maßnahmen existieren, um den neuen Ankömmling nicht sich selbst zu überlassen, wie das aktuell mit Syrern oder auch Nordafrikanern afaik passiert. Wer jetzt aber behauptet, dass unser System in die Straffälligkeit führt und er nicht für sein eigenes Handeln zur Verantwortung gezogen werden kann, führt diese Argumentation auf sehr dünnem Eis. Und das wir Straffällige mittlerweile mit Berechtigung abschieben ist ja nun kein Geheimnis mehr. Auch hängt es ja nun wieder davon ab, wann der Herr straffällig wurde. Ich weiß auch nicht, was das mit §1 zu tun hat, wenn man solche abschiebt, die offensichtlich ein Problem mit unserem Rechtssystem haben, immerhin muss hier keiner straffällig werden, um zu überleben, höchstens, um mehr zu haben, als die meisten anderen.  Wir sind nach wie vor heute ein Land getrieben von Migration, in Masse erfolgreich, aber es muss erlaubt sein, dass man die, die hier nicht reinpassen auch wieder aussiedeln darf, sofern sie nicht bereits die Staatsbürgerschaft erlangt haben. Nicht anders läuft es in anderen Ländern, warum wir immer den moralischen Überflieger;einirrer
572;1;28;"... spielen müssen, entzieht sich mir, sofern es nicht zufällig mit der jüngeren Geschichte zu tun haben sollte. Kanada, die USA, Australien, Neuseeland, England, alle mir bekannten Länder gehen hart gegen Migranten vor, die sich entsprechend nicht an das vor Ort geltende Recht halten. Wenn man selbst nur geduldet wird oder anderswie subsidiären Schutz gewährt bekommt, sollte es im eigenen Ermessen liegen, sich an geltendes Recht zu halten. Abgesehen davon ist der Prozess von der Straffälligkeit zur Abschiebung auch kein Schleudersitz, man hat ja mehr als einen ""Strike"" frei. Nur irgendwann reicht es eben dann auch.";einirrer
573;1;29;Mit der Aussage wäre ich vorsichtig oder gibt es da entsprechende Studien zu, die dies irgendwie belegen? Es gibt auch noch die Verlockung des schnellen Geldes und Körperverletzungen können afaik auch von Menschen aus bestem Hause ausgehen. Es kommt immer auf die Situation im Leben an. Junge Menschen von der eigenen Verantwortung los zusprechen weicht die Eigenverantwortung nur noch weiter auf, dann kann man sich gleich von der Verantwortung für das eigene Handeln verabschieden, wenn man so argumentiert. Auch mit 15 sollte man schon so weit denken können, dass das eigene Handeln Konsequenzen hat. Ansonsten bekommt man es eben mit dem Rechtsstaat zu tun. Und der sieht nach aktuellem Gesetz nach §60, Abs. 8 AufenthG eben folgendes vor:  (8) Absatz 1 findet keine Anwendung, wenn der Ausländer aus schwerwiegenden Gründen als eine Gefahr für die Sicherheit der Bundesrepublik Deutschland anzusehen ist oder eine Gefahr für die Allgemeinheit bedeutet, weil er wegen eines Verbrechens oder besonders schweren Vergehens rechtskräftig zu einer Freiheitsstrafe von mindestens drei Jahren verurteilt worden ist. Das Gleiche gilt, wenn der Ausländer die Voraussetzungen des § 3 Abs. 2 des Asylgesetzes erfüllt ... rechtskräftig zu einer Freiheits- oder Jugendstrafe von mindestens einem Jahr verurteilt worden ist, sofern die Straftat mit Gewalt, unter Anwendung von Drohung mit Gefahr für Leib oder Leben oder mit List begangen worden ist oder eine... https://dejure.org/gesetz...;einirrer
574;1;30;Da gibt es noch andere Gründe: Sozialisierung, Erziehung oder gesteigerte Agressivität.;Tommy1600
575;1;31;"""Gewalt und Körperverletzung haben immer unterschiedliche auslöser von denen einer Hoffnungslosigkeit ist."" Mir fallen als erstes Aggressivität und eine niedrige Hemmschwelle ein.";Kügelchen
576;1;32;Er ist nur unser Problem, wenn man zulässt, dass einige Leute ihn zu unserem Problem machen. Diesmal hat es nicht funktioniert.;Herr Mannelig
577;1;33;Genau. Nämlich weil er bereits längst hätte abgeschoben werden müssen.;Dunkles Ahnen
578;2;2;Ja, das ist in der Tat geschmacklos. Nicht minder geschmacklos allerdings, wie die scherzhaft eingeflochtene Einlassung des Bundesinnenministers bezüglich seines Geburtstagsgeschenks.;Hamburgerin2.0
579;2;3;Sicherlich ist Seehofer nicht schuld. Und auch die Politik nicht. Aber wir sind und doch einig, dass dieser Mann sich nicht hätte töten müssen, wäre er nicht in ein von Terror geplagtes Land ohne Perspektiven abgeschoben worden. Dazu noch Seehofers äußerst zynischer Geburtstags-Kommentar. Darf man also ziehen die Verbindung.;leapforward
580;2;4;Entfernt. Bitte nutzen Sie die Kommentarbereiche zur sachlichen, differenzierten und konstruktiven Diskussion der Artikelinhalte.  Danke, die Redaktion/dl;Heringshappen
581;2;5;Was hat er denn konkret gesagt?;Haagen
582;2;6;Diese Assoziation hat sich der werte Herr Seehofer mit seinen widerwärtigen Kommentaren schon selbstzuzuschreiben. Abschiebungen in ein Krisengebiete als Geburtstagsgeschenk zu feiern - ekelerregender wird es heute nicht mehr. CSU, deine Werte.;Oliver Maus
583;2;7;Nein, da sind wir uns gar nicht einig. Depressionen sind sehr sehr gefährlich, und was es letzten Endes war, dass ihn dazu trieb, werden wir nicht mehr von ihm erfahren.;LumichGut
584;2;8;Das werde ich hier nicht wiederholen. Fragen Sie Tante Google.;Hamburgerin2.0
585;2;9;Entfernt. Bitte verzichten Sie auf überzogene Polemik. Danke, die Redaktion/spt;Tommy1600
586;2;10;Aha, wenn sich der Minister für Innere Sicherheit nicht mehr darüber freuen darf, dass Recht und Gesetz durchgesetzt wird, brauchen wir dann noch Recht und Gesetz? Sind sie ob der Verurteilung von Beate Zschäpe heute nicht auch zumindest erleichtert?;LumichGut
587;2;11;Entfernt. Bitte nutzen Sie die Kommentarbereiche zur sachlichen, differenzierten und konstruktiven Diskussion der Artikelinhalte.  Danke, die Redaktion/dl;Enceladus
